SQL> select * from employee;

     EMPID NAME                 DEPT                     SALARY
---------- -------------------- -------------------- ----------
CITY
--------------------
         1 sofia                sales                      1000
abcd

         2 arjun                finance                    2000
ambady

         3 lilly                sales                      1500
ruby


     EMPID NAME                 DEPT                     SALARY
---------- -------------------- -------------------- ----------
CITY
--------------------
         4 kathy                finance                    1200
pbvr

         5 malik                sales                      2500
kthmnglm


SQL> select name from employee where salary between 1000 and 2000;

NAME
--------------------
sofia
arjun
lilly
kathy

SQL> select name from employee where salary between 1200 and 2000;

NAME
--------------------
arjun
lilly
kathy

SQL> select * from employee order by name;

     EMPID NAME                 DEPT                     SALARY
---------- -------------------- -------------------- ----------
CITY
--------------------
         2 arjun                finance                    2000
ambady

         4 kathy                finance                    1200
pbvr

         3 lilly                sales                      1500
ruby


     EMPID NAME                 DEPT                     SALARY
---------- -------------------- -------------------- ----------
CITY
--------------------
         5 malik                sales                      2500
kthmnglm

         1 sofia                sales                      1000
abcd


SQL> update employee set salary+=250;
update employee set salary+=250
                          *
ERROR at line 1:
ORA-00927: missing equal sign


SQL> update employee set salary=salary+250;

5 rows updated.

SQL> select * from emloyee;
select * from emloyee
              *
ERROR at line 1:
ORA-00942: table or view does not exist


SQL> select * from employee;

     EMPID NAME                 DEPT                     SALARY
---------- -------------------- -------------------- ----------
CITY
--------------------
         1 sofia                sales                      1250
abcd

         2 arjun                finance                    2250
ambady

         3 lilly                sales                      1750
ruby


     EMPID NAME                 DEPT                     SALARY
---------- -------------------- -------------------- ----------
CITY
--------------------
         4 kathy                finance                    1450
pbvr

         5 malik                sales                      2750
kthmnglm


SQL> alter table employee add jod;
alter table employee add jod
                         *
ERROR at line 1:
ORA-02263: need to specify the datatype for this column


SQL> alter table employee add jod;
alter table employee add jod
                         *
ERROR at line 1:
ORA-02263: need to specify the datatype for this column


SQL> alter table employee add jod date;

Table altered.

SQL> select * from employee;

     EMPID NAME                 DEPT                     SALARY
---------- -------------------- -------------------- ----------
CITY                 JOD
-------------------- ---------
         1 sofia                sales                      1250
abcd

         2 arjun                finance                    2250
ambady

         3 lilly                sales                      1750
ruby


     EMPID NAME                 DEPT                     SALARY
---------- -------------------- -------------------- ----------
CITY                 JOD
-------------------- ---------
         4 kathy                finance                    1450
pbvr

         5 malik                sales                      2750
kthmnglm
