
SQL*Plus: Release 10.2.0.1.0 - Production on Wed Feb 14 10:10:59 2024

Copyright (c) 1982, 2005, Oracle.  All rights reserved.

SQL> connect system
Enter password:
Connected.
SQL> create table department (dep_id int primary key,dep_name varchar(20),city varchar(10));

Table created.

SQL> create table employee(emp_id int primary key,name varchar(10),salary int,dep_id int foreign key references department(dept_id));
create table employee(emp_id int primary key,name varchar(10),salary int,dep_id int foreign key references department(dept_id))
                                                                                    *
ERROR at line 1:
ORA-00907: missing right parenthesis


SQL> drop table employee;

Table dropped.

SQL> create table employee(emp_id int primary key,name varchar(10),salary int,dep_id int foreign key references department(dept_id));
create table employee(emp_id int primary key,name varchar(10),salary int,dep_id int foreign key references department(dept_id))
                                                                                    *
ERROR at line 1:
ORA-00907: missing right parenthesis


SQL> create table employee(emp_id int primary key,name varchar(10),salary int,dep_id int foreign key references department(dep_id));
create table employee(emp_id int primary key,name varchar(10),salary int,dep_id int foreign key references department(dep_id))
                                                                                    *
ERROR at line 1:
ORA-00907: missing right parenthesis


SQL> create table employee(emp_id int primary key,name varchar(10),salary int,dep_id int foreign key (dep_id) references department);
create table employee(emp_id int primary key,name varchar(10),salary int,dep_id int foreign key (dep_id) references department)
                                                                                    *
ERROR at line 1:
ORA-00907: missing right parenthesis


SQL> create table employee(emp_id int primary key,name varchar(10),salary int,dep_id int,foreignkey (dep_id) references department);
create table employee(emp_id int primary key,name varchar(10),salary int,dep_id int,foreignkey (dep_id) references department)
                                                                                               *
ERROR at line 1:
ORA-00902: invalid datatype


SQL> create table employee(emp_id int primary key,name varchar(10),salary int,dep_id int, foreignkey references department(dep_id));

Table created.

SQL> desc employee;
 Name                                      Null?    Type
 ----------------------------------------- -------- ----------------------------
 EMP_ID                                    NOT NULL NUMBER(38)
 NAME                                               VARCHAR2(10)
 SALARY                                             NUMBER(38)
 DEP_ID                                             NUMBER(38)
 FOREIGNKEY                                         NUMBER(38)

SQL> desc department;
 Name                                      Null?    Type
 ----------------------------------------- -------- ----------------------------
 DEP_ID                                    NOT NULL NUMBER(38)
 DEP_NAME                                           VARCHAR2(20)
 CITY                                               VARCHAR2(10)

SQL> drop table employee;

Table dropped.

SQL> create table employee(emp_id int primary key,name varchar(10),salary int,dep_id int,foreign key (dep_id) references department);

Table created.

SQL> desc employee;
 Name                                      Null?    Type
 ----------------------------------------- -------- ----------------------------
 EMP_ID                                    NOT NULL NUMBER(38)
 NAME                                               VARCHAR2(10)
 SALARY                                             NUMBER(38)
 DEP_ID                                             NUMBER(38)

SQL> desc department;
 Name                                      Null?    Type
 ----------------------------------------- -------- ----------------------------
 DEP_ID                                    NOT NULL NUMBER(38)
 DEP_NAME                                           VARCHAR2(20)
 CITY                                               VARCHAR2(10)

SQL> insert into department values(&dep_id,'&dep_name','&city');
Enter value for dep_id: 23
Enter value for dep_name: computer
Enter value for city: ktm
old   1: insert into department values(&dep_id,'&dep_name','&city')
new   1: insert into department values(23,'computer','ktm')

1 row created.

SQL> /
Enter value for dep_id: 12
Enter value for dep_name: chemistry
Enter value for city: pbvr
old   1: insert into department values(&dep_id,'&dep_name','&city')
new   1: insert into department values(12,'chemistry','pbvr')

1 row created.

SQL> /
Enter value for dep_id: 14
Enter value for dep_name: computer
Enter value for city: pbvr
old   1: insert into department values(&dep_id,'&dep_name','&city')
new   1: insert into department values(14,'computer','pbvr')

1 row created.

SQL> /
Enter value for dep_id: 21
Enter value for dep_name: physics
Enter value for city: kochi
old   1: insert into department values(&dep_id,'&dep_name','&city')
new   1: insert into department values(21,'physics','kochi')

1 row created.

SQL> /
Enter value for dep_id: 25
Enter value for dep_name: chemistry
Enter value for city: kochi
old   1: insert into department values(&dep_id,'&dep_name','&city')
new   1: insert into department values(25,'chemistry','kochi')

1 row created.

SQL> select * from department;

    DEP_ID DEP_NAME             CITY
---------- -------------------- ----------
        23 computer             ktm
        12 chemistry            pbvr
        14 computer             pbvr
        21 physics              kochi
        25 chemistry            kochi

SQL> insert into employee values(&emp_id,'&name',&salary,&dep_id);
Enter value for emp_id: 200
Enter value for name: lilly
Enter value for salary: 10000
Enter value for dep_id: 21
old   1: insert into employee values(&emp_id,'&name',&salary,&dep_id)
new   1: insert into employee values(200,'lilly',10000,21)

1 row created.

SQL> /
Enter value for emp_id: 201
Enter value for name: sofia
Enter value for salary: 19000
Enter value for dep_id: 23
old   1: insert into employee values(&emp_id,'&name',&salary,&dep_id)
new   1: insert into employee values(201,'sofia',19000,23)

1 row created.

SQL> /
Enter value for emp_id: 202
Enter value for name: meera
Enter value for salary: 15000
Enter value for dep_id: 14
old   1: insert into employee values(&emp_id,'&name',&salary,&dep_id)
new   1: insert into employee values(202,'meera',15000,14)

1 row created.

SQL> /
Enter value for emp_id: 203
Enter value for name: john
Enter value for salary: 20000
Enter value for dep_id: 25
old   1: insert into employee values(&emp_id,'&name',&salary,&dep_id)
new   1: insert into employee values(203,'john',20000,25)

1 row created.

SQL> /
Enter value for emp_id: 204
Enter value for name: jaas
Enter value for salary: 14000
Enter value for dep_id: 12
old   1: insert into employee values(&emp_id,'&name',&salary,&dep_id)
new   1: insert into employee values(204,'jaas',14000,12)

1 row created.

SQL> select * from employee;

    EMP_ID NAME           SALARY     DEP_ID
---------- ---------- ---------- ----------
       200 lilly           10000         21
       201 sofia           19000         23
       202 meera           15000         14
       203 john            20000         25
       204 jaas            14000         12

SQL> update employee salary=250000 where emp_id=201;
update employee salary=250000 where emp_id=201
                      *
ERROR at line 1:
ORA-00971: missing SET keyword


SQL> update employee set salary=250000 where emp_id=201;

1 row updated.

SQL> select * from employee;

    EMP_ID NAME           SALARY     DEP_ID
---------- ---------- ---------- ----------
       200 lilly           10000         21
       201 sofia          250000         23
       202 meera           15000         14
       203 john            20000         25
       204 jaas            14000         12

SQL> delete from employee where emp_id=200;

1 row deleted.

SQL> select dep_name,name from department,employee where department.dep_id=employee.dep_id;

DEP_NAME             NAME
-------------------- ----------
computer             sofia
chemistry            jaas
computer             meera
chemistry            john

SQL> select dep_name,name from department,employee;

DEP_NAME             NAME
-------------------- ----------
computer             sofia
chemistry            sofia
computer             sofia
physics              sofia
chemistry            sofia
computer             meera
chemistry            meera
computer             meera
physics              meera
chemistry            meera
computer             john

DEP_NAME             NAME
-------------------- ----------
chemistry            john
computer             john
physics              john
chemistry            john
computer             jaas
chemistry            jaas
computer             jaas
physics              jaas
chemistry            jaas

20 rows selected.

SQL> select name from employee where city="ktm";
select name from employee where city="ktm"
                                     *
ERROR at line 1:
ORA-00904: "ktm": invalid identifier


SQL> select name from employee where city='ktm';
select name from employee where city='ktm'
                                *
ERROR at line 1:
ORA-00904: "CITY": invalid identifier


SQL> select name from employee,department where city='ktm'and employee.dep_id=department.dep_id;

NAME
----------
sofia

SQL> select * from employee;

    EMP_ID NAME           SALARY     DEP_ID
---------- ---------- ---------- ----------
       201 sofia          250000         23
       202 meera           15000         14
       203 john            20000         25
       204 jaas            14000         12

SQL> select * from department;

    DEP_ID DEP_NAME             CITY
---------- -------------------- ----------
        23 computer             ktm
        12 chemistry            pbvr
        14 computer             pbvr
        21 physics              kochi
        25 chemistry            kochi

SQL> select name from employee,department where city='ktm'and employee.dep_id=department.dep_id;

NAME
----------
sofia

SQL>  delete from employee where name='jaas';

1 row deleted.

SQL> select * from employee;

    EMP_ID NAME           SALARY     DEP_ID
---------- ---------- ---------- ----------
       201 sofia          250000         23
       202 meera           15000         14
       203 john            20000         25

SQL> update employee set salary=salary+500 where dept_id=14;
update employee set salary=salary+500 where dept_id=14
                                            *
ERROR at line 1:
ORA-00904: "DEPT_ID": invalid identifier


SQL> update employee set salary=salary+500 where dep_id=14;

1 row updated.

SQL> select * from employee;

    EMP_ID NAME           SALARY     DEP_ID
---------- ---------- ---------- ----------
       201 sofia          250000         23
       202 meera           15500         14
       203 john            20000         25

SQL> select name,dep_name from employee,department where salary>19000 and employee.dep_id=department>dep_id;
select name,dep_name from employee,department where salary>19000 and employee.dep_id=department>dep_id
                                                                                               *
ERROR at line 1:
ORA-00933: SQL command not properly ended


SQL> select name,dep_name from employee,department where salary>19000 and employee.dep_id=department.dep_id;

NAME       DEP_NAME
---------- --------------------
sofia      computer
john       chemistry

SQL>